{
  "tx_id": "7e916adc-1f36-4f1e-81f9-57a4ab4ad183",
  "type": "uk.gov.ons.edc.eq:feedback",
  "version": "v2",
  "data_version": "0.0.3",
  "origin": "uk.gov.ons.edc.eq",
  "flushed": false,
  "submitted_at": "2026-06-19T14:06:29.474909+00:00",
  "launch_language_code": "en",
  "submission_language_code": "en",
  "collection_exercise_sid": "77d00da0-9245-40a3-9219-a9f860066167",
  "period_id": "2027",
  "schema": {
    "survey": "CENSUS",
    "form_type": "H",
    "region_code": "GB-ENG"
  },
  "schema_name": "census_household_gb_eng",
  "case_id": "f48e8790-f591-4086-9f6d-98c8642d96cb",
  "survey_metadata": {
    "user_id": "UNKNOWN",
    "display_address": "15 Credibility Street, Bristol, BS7 8ES",
    "questionnaire_id": "1234567890",
    "case_type": "HH",
    "ru_ref": "uprn:00001"
  },
  "data": {
    "feedback_text": "The 2021 Census was fantastic! I hope you do it all again in 2027!",
    "feedback_type": "General feedback about this service",
    "feedback_count": "1"
  },
  "channel": "rh",
  "started_at": "2026-06-19T14:04:53.323989+00:00"
}
